{"acceptance_holdout_opened":false,"acceptance_rule_created":false,"assignment_blind_summary":{"artifact":{"bytes":69808,"path":"data/modeling/model-validation-structural-diagnosis-2026-08-28/assignment-blind/06057/diagnosis.json","sha256":"4820592ae13fc2ebf442fa21eb0169b39cf0272b01a697bf1bd209ac9e4b554f"},"matching":{"ambiguous_lineage":2,"exclusion_reasons":{"aadt_unavailable_for_section":3176,"ramp_not_represented_by_retained_network":94},"facility_evidence_present":0,"frozen_candidate_count_distribution":{"0":6260,"5":4},"frozen_statuses":{"ambiguous":98,"excluded":3270,"matched":4,"unresolved":2892},"full_link_within_radius_but_centroid_outside":34,"genuine_network_absence_within_search_distance":0,"missing_declared_canonical_observation":0,"name_evidence_present":135,"nearby_network_with_unmatched_name_or_facility_evidence":29,"nearby_network_without_name_or_facility_evidence":2859},"model_output_bytes_read":false,"observation":{"evidence_grades":{"B":4,"C":2986,"D":3274},"missing_usable_point_coordinates":4,"records":6264,"source_supported_bounds_unknown":6264}},"calibrated":false,"candidate_selected":false,"claim_tier_changed":false,"created_at":"2026-08-28T18:45:00+00:00","diagnosis_id":"06057:aequilibrae:structural-diagnosis-v1","evidence_ledger":{"assignment_period":{"evidence":[{"json_pointer":"/assignment_period","path":"data/modeling/development-validation-study-2026-08-28/results/06057/aequilibrae/comparison-basis.json","sha256":"2827aa9a776c9ff2e9507d8a9447ff6826d34338612b25139da15188eabb754c"}],"status":"proved","value":{"hours":[0,1,2,3,4,5,6,7,8,9,10,11,12,13,14,15,16,17,18,19,20,21,22,23],"label":"daily"}},"assignment_profile":{"evidence":[{"json_pointer":"","path":"data/modeling/development-validation-study-2026-08-28/results/06057/aequilibrae/assignment-profile.json","sha256":"5fcab976e435801f5a04d7f6b37e467850cbcc7d1f650e7cf8c13f625d565157"}],"status":"proved","value":{"algorithm":"bfw","capacity_field":"capacity","class_pce":1,"cores":1,"engine":"aequilibrae","engine_version":"1.6.2","max_iterations":3000,"profile_id":"aequilibrae-bfw-bpr-tight-v1","schema_version":"openplan.assignment-profile.v1","target_gap":0.0005,"time_field":"travel_time","vdf":"BPR","vdf_parameters":{"alpha":0.15,"beta":4}}},"coefficients":{"evidence":[],"status":"unknown","value":"unknown"},"day_basis":{"evidence":[],"status":"unknown","value":"unknown"},"direction":{"evidence":[{"json_pointer":"/direction_basis","path":"data/modeling/development-validation-study-2026-08-28/results/06057/aequilibrae/comparison-basis.json","sha256":"2827aa9a776c9ff2e9507d8a9447ff6826d34338612b25139da15188eabb754c"}],"status":"proved","value":{"artifact_sha256":"66f73419e2d11d2afadfdbfa9de2479d79580333a5392786588b4f1f47221750","basis":"two_way","evidence":"pre-volume audit sums frozen paired carriageways and retains single two-way links"}},"model_year":{"evidence":[],"status":"unknown","value":"unknown"},"population_vintage":{"evidence":[],"status":"unknown","value":"unknown"},"vehicle_pce_basis":{"evidence":[{"json_pointer":"/vehicle_basis","path":"data/modeling/development-validation-study-2026-08-28/results/06057/aequilibrae/comparison-basis.json","sha256":"2827aa9a776c9ff2e9507d8a9447ff6826d34338612b25139da15188eabb754c"}],"status":"proved","value":{"unit":"pce","vehicle_pce_conversion":{"artifact_sha256":"5fcab976e435801f5a04d7f6b37e467850cbcc7d1f650e7cf8c13f625d565157","factor":1.0,"status":"proven"}}}},"exact_inputs":{"assignment_blind_diagnosis":{"bytes":69808,"path":"data/modeling/model-validation-structural-diagnosis-2026-08-28/assignment-blind/06057/diagnosis.json","sha256":"4820592ae13fc2ebf442fa21eb0169b39cf0272b01a697bf1bd209ac9e4b554f"},"assignment_profile":{"bytes":335,"path":"data/modeling/development-validation-study-2026-08-28/results/06057/aequilibrae/assignment-profile.json","sha256":"5fcab976e435801f5a04d7f6b37e467850cbcc7d1f650e7cf8c13f625d565157"},"comparison_basis":{"bytes":2249,"path":"data/modeling/development-validation-study-2026-08-28/results/06057/aequilibrae/comparison-basis.json","sha256":"2827aa9a776c9ff2e9507d8a9447ff6826d34338612b25139da15188eabb754c"},"existing_assessment":{"bytes":430537,"path":"data/modeling/development-validation-study-2026-08-28/results/06057/aequilibrae/assessment.json","sha256":"d185c933c74f0e0a547db280e7453e0022f77e575094d3551c1b075a7fd5103b"},"model_output":{"bytes":4097936,"path":"data/modeling/development-validation-study-2026-08-28/runs/v039-development-06057-aequilibrae/run_output/link_volumes.csv","sha256":"ee8e70cfe4424ae9626565dbdc2813dfff7610b3fceffd3ba42e61ffa2f9305e"},"network":{"bytes":27840512,"path":"data/modeling/development-validation-study-2026-08-28/instruments/06057/network/project_database.sqlite","sha256":"069976888ac6e49d62797934a1768eb00e5c7214d0267ea5df78c59765b0dccf"},"observation_package":{"bytes":13529333,"path":"data/modeling/development-validation-study-2026-08-28/instruments/06057/observation-package.json","sha256":"3d557b7709aeaf972f358a2dcf62bb10b8c894fb04683b7486252f785ab261c0"},"pre_volume_match_audit":{"bytes":3473434,"path":"data/modeling/development-validation-study-2026-08-28/instruments/06057/pre-volume-match-audit.json","sha256":"66f73419e2d11d2afadfdbfa9de2479d79580333a5392786588b4f1f47221750"},"preregistration":{"bytes":3087,"path":"scripts/modeling/development/california_validation_instrument_study.v2.json","sha256":"85bced73c23ab6f19a3eb2b606eb77204ef0595850e20af2ea445f59ce6863a4"}},"findings":[{"category":"observation","classification":"cause","code":"missing_usable_point_coordinates","count":4,"statement":"The frozen matcher cannot evaluate a location when the observation has no usable GeoJSON point coordinate pair."},{"category":"matching","classification":"cause","code":"centroid_geometry_excludes_full_link","count":34,"statement":"A full link lies inside the frozen distance while that link's centroid lies outside it. The diagnosis does not replace the frozen match."},{"category":"matching","classification":"finding","code":"genuine_network_absence_within_search_distance","count":0,"statement":"No frozen network link geometry lies within the search distance for these usable coordinates."},{"category":"matching","classification":"cause","code":"nearby_network_without_name_or_facility_evidence","count":2859,"statement":"A network link lies within the search distance, but the observation supplies neither name nor facility evidence required by the frozen matcher. This causes candidate exclusion without selecting a replacement link."},{"category":"matching","classification":"finding","code":"nearby_network_with_unmatched_name_or_facility_evidence","count":29,"statement":"A network link lies within the search distance and the observation has some route or facility evidence, but the frozen audit retained no candidate. The diagnosis does not infer a corrected match."},{"category":"network_loading","classification":"finding","code":"frozen_matched_links_missing_from_output","count":0,"statement":"A frozen matched link absent from the method output cannot produce a comparable modeled quantity."},{"category":"network_loading","classification":"finding","code":"frozen_matched_links_with_zero_assigned_volume","count":0,"statement":"A recorded zero on a frozen matched link is retained as unloaded, not discarded or relabeled as a missing output row."},{"category":"comparability","classification":"cause","code":"comparison_basis_facts_unknown","count":4,"statement":"Absent basis facts remain unknown and block a same-quantity claim.","unknown_facts":["coefficients","day_basis","model_year","population_vintage"]},{"category":"method_disagreement","classification":"finding","code":"paired_raw_values_retained_separately","count":4,"statement":"Raw values, differences, and ratios are reported on identical frozen links without averaging or selecting a method."}],"geography_id":"06057","match_changes":0,"method":"aequilibrae","method_aggregation":"separate","paired_method_comparison":{"aggregation":"none","both_values_available_records":4,"ranking":"none","records":[{"activitysim":{"assignment_state":"loaded_nonzero","output_row_present":true,"raw_value":25144.169694679258},"aequilibrae":{"assignment_state":"loaded_nonzero","output_row_present":true,"raw_value":27394.51969357017},"aequilibrae_minus_activitysim":2250.3499988909134,"aequilibrae_to_activitysim_ratio":1.0894978846474739,"frozen_link_ids":["9336"],"identical_frozen_links":true,"observation_id":"us-state-ca:171d173232dc01e0830f"},{"activitysim":{"assignment_state":"loaded_nonzero","output_row_present":true,"raw_value":25144.169694679258},"aequilibrae":{"assignment_state":"loaded_nonzero","output_row_present":true,"raw_value":27394.51969357017},"aequilibrae_minus_activitysim":2250.3499988909134,"aequilibrae_to_activitysim_ratio":1.0894978846474739,"frozen_link_ids":["9336"],"identical_frozen_links":true,"observation_id":"us-state-ca:3ad3fc5fabccaaded4fb"},{"activitysim":{"assignment_state":"loaded_nonzero","output_row_present":true,"raw_value":25144.169694679258},"aequilibrae":{"assignment_state":"loaded_nonzero","output_row_present":true,"raw_value":27394.51969357017},"aequilibrae_minus_activitysim":2250.3499988909134,"aequilibrae_to_activitysim_ratio":1.0894978846474739,"frozen_link_ids":["9336"],"identical_frozen_links":true,"observation_id":"us-state-ca:91d099327592c0bcbff8"},{"activitysim":{"assignment_state":"loaded_nonzero","output_row_present":true,"raw_value":25144.169694679258},"aequilibrae":{"assignment_state":"loaded_nonzero","output_row_present":true,"raw_value":27394.51969357017},"aequilibrae_minus_activitysim":2250.3499988909134,"aequilibrae_to_activitysim_ratio":1.0894978846474739,"frozen_link_ids":["9336"],"identical_frozen_links":true,"observation_id":"us-state-ca:94de36821e676a7af70d"}],"records_with_unavailable_method":0,"records_with_unloaded_method":0,"winner":"none","zero_denominator_ratios_retained_as_unknown":0},"post_assignment":{"network_loading":{"loaded_reco